{
  "id": "coding-migration-planner",
  "title": "Migration Planner",
  "description": "Steps + rollback + blast radius typed. Risky schema/API migrations. Typed v1 agent with eval coverage.",
  "category": "coding",
  "status": "validated",
  "version": "1.0.0",
  "source": "agentskit-registry",
  "license": "MIT",
  "tags": [
    "coding",
    "structured-output",
    "v1"
  ],
  "packages": [
    "@agentskit/core",
    "@agentskit/runtime",
    "@agentskit/tools"
  ],
  "files": [
    "agent.ts",
    "README.md",
    "eval.ts"
  ],
  "requires": {
    "zod": "^3",
    "zod-to-json-schema": "^3"
  }
}
