{
  "id": "ecommerce-fulfillment-sla-monitor",
  "title": "Fulfillment SLA Monitor",
  "description": "Alerts typed. SLA breaches. Typed v1 agent with eval coverage.",
  "category": "ecommerce",
  "status": "validated",
  "version": "1.0.0",
  "source": "agentskit-registry",
  "license": "MIT",
  "tags": [
    "ecommerce",
    "structured-output",
    "v1"
  ],
  "packages": [
    "@agentskit/core",
    "@agentskit/runtime",
    "@agentskit/tools"
  ],
  "files": [
    "agent.ts",
    "README.md",
    "eval.ts"
  ],
  "requires": {
    "zod": "^3",
    "zod-to-json-schema": "^3"
  }
}
