{
  "id": "fintech-insurance-claim-triage",
  "title": "Insurance Claim Triage",
  "description": "Triage typed. Claim intake slow. Typed v1 agent with eval coverage.",
  "category": "fintech",
  "status": "validated",
  "version": "1.0.0",
  "source": "agentskit-registry",
  "license": "MIT",
  "tags": [
    "fintech",
    "structured-output",
    "v1"
  ],
  "packages": [
    "@agentskit/core",
    "@agentskit/runtime",
    "@agentskit/tools"
  ],
  "files": [
    "agent.ts",
    "README.md",
    "eval.ts"
  ],
  "requires": {
    "zod": "^3",
    "zod-to-json-schema": "^3"
  }
}
