{
  "id": "ops-compliance-checklist",
  "title": "Compliance Checklist",
  "description": "Checklist typed. Compliance ad-hoc. Alpha: auto-implemented typed agent — review before production.",
  "category": "ops",
  "status": "alpha",
  "version": "0.1.0-alpha",
  "source": "agentskit-registry",
  "license": "MIT",
  "tags": [
    "ops",
    "alpha",
    "structured-output"
  ],
  "packages": [
    "@agentskit/core",
    "@agentskit/runtime",
    "@agentskit/tools"
  ],
  "files": [
    "agent.ts",
    "README.md",
    "eval.ts"
  ],
  "requires": {
    "zod": "^3",
    "zod-to-json-schema": "^3"
  }
}
