{
  "id": "realestate-offer-letter-drafter",
  "title": "Offer Letter Drafter",
  "description": "Offer typed. Offers manual. Typed v1 agent with eval coverage.",
  "category": "realestate",
  "status": "validated",
  "version": "1.0.0",
  "source": "agentskit-registry",
  "license": "MIT",
  "tags": [
    "realestate",
    "structured-output",
    "v1"
  ],
  "packages": [
    "@agentskit/core",
    "@agentskit/runtime",
    "@agentskit/tools"
  ],
  "files": [
    "agent.ts",
    "README.md",
    "eval.ts"
  ],
  "requires": {
    "zod": "^3",
    "zod-to-json-schema": "^3"
  }
}
