{
  "id": "clinical-referral-router",
  "title": "Referral Router",
  "description": "Routes a referral packet to the receiving specialty + urgency with typed output. Incomplete packets are NOT assigned — missing critical fields (reason/meds/prior workup) are surfaced and the case escalates to a human coordinator. Fail-safe on error.",
  "category": "clinical",
  "version": "2.0.0",
  "source": "AgentsKit Registry",
  "license": "MIT",
  "tags": [
    "clinical",
    "routing",
    "classification",
    "human-in-the-loop"
  ],
  "packages": [
    "@agentskit/core",
    "@agentskit/runtime",
    "@agentskit/tools"
  ],
  "requires": {
    "zod": "^3",
    "zod-to-json-schema": "^3"
  },
  "files": [
    "agent.ts",
    "README.md",
    "eval.ts"
  ],
  "status": "validated"
}
