{
  "id": "product-metrics-tree-author",
  "title": "Metrics Tree Author",
  "description": "Tree typed. Metrics trees ad-hoc. Typed v1 agent with eval coverage.",
  "category": "product",
  "status": "validated",
  "version": "1.0.0",
  "source": "agentskit-registry",
  "license": "MIT",
  "tags": [
    "product",
    "structured-output",
    "v1"
  ],
  "packages": [
    "@agentskit/core",
    "@agentskit/runtime",
    "@agentskit/tools"
  ],
  "files": [
    "agent.ts",
    "README.md",
    "eval.ts"
  ],
  "requires": {
    "zod": "^3",
    "zod-to-json-schema": "^3"
  }
}
