{
  "id": "hr-learning-path-builder",
  "title": "Learning Path Builder",
  "description": "Path typed. Learning paths manual. Alpha: auto-implemented typed agent — review before production.",
  "category": "hr",
  "status": "alpha",
  "version": "0.1.0-alpha",
  "source": "agentskit-registry",
  "license": "MIT",
  "tags": [
    "hr",
    "alpha",
    "structured-output"
  ],
  "packages": [
    "@agentskit/core",
    "@agentskit/runtime",
    "@agentskit/tools"
  ],
  "files": [
    "agent.ts",
    "README.md",
    "eval.ts"
  ],
  "requires": {
    "zod": "^3",
    "zod-to-json-schema": "^3"
  }
}
