{
  "id": "ecommerce-abandoned-cart-copy",
  "title": "Abandoned Cart Copy",
  "description": "Copy typed. Cart recovery weak. Alpha: auto-implemented typed agent — review before production.",
  "category": "ecommerce",
  "status": "alpha",
  "version": "0.1.0-alpha",
  "source": "agentskit-registry",
  "license": "MIT",
  "tags": [
    "ecommerce",
    "alpha",
    "structured-output"
  ],
  "packages": [
    "@agentskit/core",
    "@agentskit/runtime",
    "@agentskit/tools"
  ],
  "files": [
    "agent.ts",
    "README.md",
    "eval.ts"
  ],
  "requires": {
    "zod": "^3",
    "zod-to-json-schema": "^3"
  }
}
