{
  "id": "marketing-competitor-researcher",
  "title": "Competitor Researcher",
  "description": "Searches + fetches competitor web content (webSearch / fetchUrl), diffs it against the RAG competitor baseline, and produces a structured competitive-landscape report. Hardened: fetched pages are treated as attacker-controlled data (prompt-injection defense), and unfetchable sources are flagged, never fabricated.",
  "category": "marketing",
  "version": "1.1.0",
  "source": "AgentsKit Registry",
  "license": "MIT",
  "tags": [
    "marketing",
    "research",
    "prompt-injection-defense"
  ],
  "packages": [
    "@agentskit/core",
    "@agentskit/runtime",
    "@agentskit/tools"
  ],
  "files": [
    "agent.ts",
    "README.md",
    "eval.ts"
  ],
  "status": "validated"
}
