{
  "id": "ecosystem-doc-bridge-memory-classifier",
  "title": "Doc-bridge Memory Classifier",
  "description": "Candidates typed: promote/hold/reject + rationale. Private notes → memory candidates for doc-bridge. Alpha: auto-implemented typed agent — review before production.",
  "category": "ecosystem",
  "status": "alpha",
  "version": "0.1.0-alpha",
  "source": "agentskit-registry",
  "license": "MIT",
  "tags": [
    "ecosystem",
    "doc-bridge",
    "dogfood",
    "alpha",
    "structured-output"
  ],
  "packages": [
    "@agentskit/core",
    "@agentskit/runtime",
    "@agentskit/tools"
  ],
  "files": [
    "agent.ts",
    "README.md",
    "eval.ts"
  ],
  "requires": {
    "zod": "^3",
    "zod-to-json-schema": "^3"
  },
  "ecosystem": true
}
