{
  "id": "legal-contract-reviewer",
  "title": "Contract Reviewer",
  "description": "Reviews uploaded contracts clause-by-clause for risky language.",
  "category": "legal",
  "version": "1.0.0",
  "source": "agentskit-os",
  "license": "MIT",
  "tags": [
    "legal"
  ],
  "packages": [
    "@agentskit/core",
    "@agentskit/runtime"
  ],
  "files": [
    "agent.ts",
    "README.md",
    "eval.ts"
  ]
}
