{
  "id": "agency-deck-builder",
  "title": "Deck Builder",
  "description": "Drafts a TYPED pitch/status deck (typed slides with bullets + citations) from project artifacts. Every number must cite its source artifact — uncited metrics are flagged in uncitedMetrics, missing data becomes 'data to be confirmed'. Configurable sections; always a draft.",
  "category": "agency",
  "version": "2.0.0",
  "source": "AgentsKit Registry",
  "license": "MIT",
  "tags": [
    "agency",
    "structured-output",
    "grounding"
  ],
  "packages": [
    "@agentskit/core",
    "@agentskit/runtime",
    "@agentskit/tools"
  ],
  "files": [
    "agent.ts",
    "README.md",
    "eval.ts"
  ],
  "requires": {
    "zod": "^3",
    "zod-to-json-schema": "^3"
  },
  "status": "validated"
}
