{
  "id": "compliance-lgpd-dpa-reviewer",
  "title": "LGPD DPA Reviewer",
  "description": "Findings typed. DPA review BR. Typed v1 agent with eval coverage.",
  "category": "compliance",
  "status": "validated",
  "version": "1.0.0",
  "source": "agentskit-registry",
  "license": "MIT",
  "tags": [
    "compliance",
    "structured-output",
    "v1"
  ],
  "packages": [
    "@agentskit/core",
    "@agentskit/runtime",
    "@agentskit/tools"
  ],
  "files": [
    "agent.ts",
    "README.md",
    "eval.ts"
  ],
  "requires": {
    "zod": "^3",
    "zod-to-json-schema": "^3"
  },
  "locale": "br"
}
