{
  "id": "fintech-sanctions-screener",
  "title": "Sanctions Screener",
  "description": "Screens a customer/counterparty against a sanctions list with a DETERMINISTIC fuzzy-match gate: strong/exact hits escalate unconditionally (never model-cleared), the model only adjudicates weak near-misses (and can only make screening stricter). Typed verdict + human sign-off.",
  "category": "fintech",
  "version": "2.0.0",
  "source": "AgentsKit Registry",
  "license": "MIT",
  "tags": [
    "fintech",
    "compliance",
    "sanctions",
    "kyc",
    "deterministic-gate",
    "human-in-the-loop"
  ],
  "packages": [
    "@agentskit/core",
    "@agentskit/runtime",
    "@agentskit/tools"
  ],
  "requires": {
    "zod": "^3",
    "zod-to-json-schema": "^3"
  },
  "files": [
    "agent.ts",
    "README.md",
    "eval.ts"
  ],
  "status": "validated"
}
