{
  "id": "clinical-medication-reconciliation",
  "title": "Medication Reconciliation",
  "description": "Reconciliation typed. Med rec errors. Alpha: auto-implemented typed agent — review before production.",
  "category": "clinical",
  "status": "alpha",
  "version": "0.1.0-alpha",
  "source": "agentskit-registry",
  "license": "MIT",
  "tags": [
    "clinical",
    "alpha",
    "structured-output"
  ],
  "packages": [
    "@agentskit/core",
    "@agentskit/runtime",
    "@agentskit/tools"
  ],
  "files": [
    "agent.ts",
    "README.md",
    "eval.ts"
  ],
  "requires": {
    "zod": "^3",
    "zod-to-json-schema": "^3"
  }
}
