{
  "id": "ops-asset-inventory-reconciler",
  "title": "Asset Inventory Reconciler",
  "description": "Drift typed. Asset drift. Typed v1 agent with eval coverage.",
  "category": "ops",
  "status": "validated",
  "version": "1.0.0",
  "source": "agentskit-registry",
  "license": "MIT",
  "tags": [
    "ops",
    "structured-output",
    "v1"
  ],
  "packages": [
    "@agentskit/core",
    "@agentskit/runtime",
    "@agentskit/tools"
  ],
  "files": [
    "agent.ts",
    "README.md",
    "eval.ts"
  ],
  "requires": {
    "zod": "^3",
    "zod-to-json-schema": "^3"
  }
}
